"Subject code","Catalog Number","Course Title","Course Description","Grading Basis","Course Typically Offered"
"ECE","489","Advanced Robot System Design","Teams will design, implement, and integrate a robotic system to perform intelligent physical tasks. Tasks might include navigation, coordinated movement, or object manipulation, among others. Perception, control, and artificial intelligence software will be applied to operate sensing and actuation hardware. Robot middleware for distributed system integration. Simulation prototyping, unit testing, and metrics for performance evaluation. Major design project. Prerequisite: ECE 230L, 250D, 270DL, 280L, & 383 & (ECE 353/CS 310 or ECE 356/CS 356 or ECE 382L) & (MATH 353 or 356) & ( MATH 230, 231 or 340, or ECE 555 or 380, or STA 240L or EGR 238L) and (PHYS 152L or 26) and (CHEM 101DL or 20 or 21).","Graded","Spring Only"
"ECE","490D","Special Topics in Electrical and Computer Engineering","Study arranged on a special electrical and computer engineering topic in which the faculty has particular interest and competence as a result of research and professional activities. Instructor consent required.","Graded","Fall and/or Spring"
"ECE","490L","Special Topics in Electrical and Computer Engineering","Study arranged on a special electrical and computer engineering topic in which the faculty has particular interest and competence as a result of research and professional activities. Instructor consent required.","Graded","Fall and/or Spring"
"ECE","493","Projects in Electrical and Computer Engineering","Project arranged on a special topic by an instructor with related interests and expertise. For senior students. Consent of instructor and director of undergraduate studies required.","Graded","Fall Only"
"ECE","494","Projects in Electrical and Computer Engineering","Project arranged on a special topic by an instructor with related interests and expertise. For senior students. Consent of instructor and director of undergraduate studies required.","Graded","Spring Only"
"ECE","495","Special Topics in Electrical and Computer Engineering","Study of selected topics in electrical engineering tailored to fit the requirements of a small group. Consent of instructor and director of undergraduate studies required.","Graded","Fall Only"
"ECE","496","Special Topics in Electrical and Computer Engineering","Study of selected topics in electrical engineering tailored to fit the requirements of a small group. Consent of instructor and director of undergraduate studies required.","Graded","Spring Only"
"ECE","110L9","Fundamentals of Electrical and Computer Engineering - Lab","Students learn core ECE concepts, providing a foundation on which subsequent courses build. Concepts include techniques for analyzing linear circuits, semiconductor and photonic devices, frequency representation, filtering, combinational and sequential logic. Central to the course is an extensive design challenge that requires students to integrate knowledge across topics while honing practical design and project management skills. Course culminates in an exciting competition in which teams of robots race to overcome challenging obstacles using sensor data acquisition and processing.","Unattached Labs","Fall and/or Spring"
"ECE","230L9","Introduction to Microelectronic Devices and Circuits-Lab","Introduction to semiconductor materials and their corresponding electronic devices and circuits. In lab, students will perform photolithography and characterize devices and circuits. Lecture will cover: underlying physics of semiconductor materials; operation of semiconductor devices, including diodes and transistors (MOSFETs); and application of MOSFETs into digital circuits. Students will understand basic operation of semiconductor devices in a way that is foundational for the expansive semiconductor industry. Prerequisite: (Engineering 103L or Computer Science 201) and (Physics 152L or 26) and (Electrical and Computer Engineering 110L or Biomedical Engineering 253L).","Unattached Labs","Fall and/or Spring"
"ECE","270L9","Fields and Waves: Fundamentals of Information Propagation (Lab)","Introduces the concept of fields—a mathematical description of physical quantities that vary from place to place (and potentially from time to time)—and explores the mathematical and physical reasons that oscillatory behavior is so ubiquitous across engineering and physics. Introduces the mathematical foundations, followed by specific examples in electrical circuits, electromagnetic waves, quantum mechanics, and acoustics as well as the connection to Fourier analysis methods. Intended to facilitate subsequent study in any area involving wave phenomena, including analog and microwave circuits, electromagnetics, optics, and quantum mechanics. Prerequisite: Physics 152L or 26, Mathematics 212 or 222, and ECE 110L.","Unattached Labs","-"
"ECE","280L9","Signals and Systems - Lab","Continuous and discrete signal representation and classification; system classification and response; transfer functions. Fourier series; Fourier, Laplace, and z transforms. Applications to Integrated Sensing and Information Processing; networks, modulation, sampling, filtering, and digital signal processing. Laboratory projects using digital signal processing hardware and microcontrollers. Computational solutions of problems using Matlab and Maple.","Unattached Labs","Fall and/or Spring"