"Subject code","Catalog Number","Course Title","Course Description","Grading Basis","Course Typically Offered"
"ECE","110L","Fundamentals of Electrical and Computer Engineering","Students learn core ECE concepts, providing a foundation on which subsequent courses build. Concepts include techniques for analyzing linear circuits, semiconductor and photonic devices, frequency representation, filtering, combinational and sequential logic. Central to the course is an extensive design challenge that requires students to integrate knowledge across topics while honing practical design and project management skills. Course culminates in an exciting competition in which teams of robots race to overcome challenging obstacles using sensor data acquisition and processing. Prerequisite/corequisite: (Engineering 103L or Engineering 105L or Computer Science 201) and (Mathematics 112L or 22 or equivalent).","Graded","Fall and/or Spring"
"ECE","230L","Introduction to Microelectronic Devices and Circuits","Introduction to semiconductor materials and their corresponding electronic devices and circuits. In lab, students will perform photolithography and characterize devices and circuits. Lecture will cover: underlying physics of semiconductor materials; operation of semiconductor devices, including diodes and transistors (MOSFETs); and application of MOSFETs into digital circuits. Students will understand basic operation of semiconductor devices in a way that is foundational for the expansive semiconductor industry.","Graded","Fall and/or Spring"
"ECE","250D","Computer Architecture","Computer structure, assembly language, instruction execution, addressing techniques, and digital representation of data. Computer system organization, logic design, microprogramming, cache and memory systems, and input/output interfaces. Prerequisite: Computer Science 201.","Graded","Fall and/or Spring"
"ECE","253","User Research Methods in Human-Centered Computing","This course serves as an introduction to a wide range of user-centered research study design methods and quantitative and qualitative data analysis techniques that students can use to capture users' perceived and real attitudes and behaviors toward technologies and policies. The course is most suitable for students who have some programming, algorithms, and data analysis background (e.g., an undergraduate computer programming course, such as Computer Science 201). In addition, having statistical knowledge and experience using statistical analysis tools, including R, Python, and STATA, is encouraged but not required.","Graded","Fall Only"
"ECE","270DL","Fields and Waves: Fundamentals of Information Propagation","Introduces the concept of fields - a mathematical description of physical quantities that vary from place to place (and potentially from time to time) - and explores the mathematical & physical reasons that oscillatory behavior is so ubiquitous across engineering and physics. Introduces mathematical foundations, followed by specific examples in electrical circuits, electromagnetic waves, quantum mechanics, & acoustics as well as the connection to Fourier analysis methods. Intended to facilitate subsequent study in any area involving wave phenomena, including analog & microwave circuits, electromagnetics, optics, & quantum mechanics. Prerequisite: Physics 152L, Math 212 or 219 or 222, & ECE 110L.","Graded","Fall and/or Spring"
"ECE","280L","Introduction to Signals and Systems","Introduction to signals, signal properties, systems, and system properties. Time and frequency domain analysis of signals and systems. Exploration of filtering, sampling, communication systems, image processing, and other real-world applications. Laboratory projects using signal processing tools to investigate real world scenarios. Computational analysis of one and two dimensional signals and systems.","Graded","Fall and/or Spring"
"ECE","290","Special Topics in Electrical and Computer Engineering","Study arranged on a special electrical and computer engineering topic in which the faculty has particular interest and competence as a result of research and professional activities. Instructor consent required.","Graded","Fall and/or Spring"
"ECE","291","Projects in Electrical and Computer Engineering","Project arranged on a special topic by an instructor with related interests and expertise. For sophomore students. Consent of instructor and director of undergraduate studies required.","Graded","Fall Only"
"ECE","292","Projects in Electrical and Computer Engineering","Project arranged on a special topic by an instructor with related interests and expertise. For sophomore students. Consent of instructor and director of undergraduate studies required.","Graded","Spring Only"
"ECE","330L","Fundamentals of Microelectronic Devices","Fundamentals of semiconductor device physics (semiconductor technology, dopants and carrier concentrations, carrier drift and diffusion, semiconductor equations, semiconductor device models). Principles of semiconductor device analysis (current-voltage and capacitance-voltage characteristics). Static, small-signal, and dynamic operation of semiconductor contacts, PN-junction diodes, MOS capacitors, MOS field-effect transistors (MOSFETs), and bipolar-junction transistors (BJTs). SPICE models and parameter extraction. Fabrication and electrical characterization of MOS capacitors in the Shared Materials Instrumentation Facility (SMIF). Prerequisite: ECE 230L.","Graded","Fall Only"
"ECE","331L","Fundamentals of Microelectronic Circuits","Analysis and design of electronic circuits in bipolar and MOS technologies, with emphasis on both large-signal and small-signal methods. Circuits for logic gates, latches, and memories. Single-stage and multistage amplifiers and op amps. Circuits with feedback, including stability and frequency response considerations. Analog and mixed analog/digital circuit applications. Extensive use of SPICE for circuit simulation. Prerequisite: Electrical and Computer Engineering 230L.","Graded","Fall and/or Spring"
"ECE","340L","Optics and Photonics","Ray optics, wave optics, beam optics, resonators, atom-photons, interaction, interference, diffraction, polarization, lasers, light detection, electromagnetic optics. Laboratory experiments apply concepts in basic optics. Prerequisite: Electrical and Computer Engineering 270L or equivalent.","Graded","Fall Only"
"ECE","341L","Solar Cells","A broad overview of solar cells, including solar radiation, device theory, materials options, device fabrication and characterization, and system-level issues. Students participate in hands-on laboratory exercises related to the fabrication and characterization of organic, photovoltaic solar cells. Prerequisite: Physics 152L or equivalent.","Graded","Spring Only"
"ECE","350L","Digital Systems","Design and implementation of combinational and sequential digital systems with special attention to digital computers. The use of computer-aided design tools, hardware description languages, and programmable logic chips to facilitate larger and higher performance designs will be stressed. Laboratory exercises and group design projects will reinforce the various design techniques discussed in class. Prerequisite: Electrical and Computer Engineering 250D or Computer Science 250.","Graded","Spring Only"
"ECE","351","Software Engineering","This course covers requirements analysis, design principles, abstraction, design patterns, software architecture, code reviews, code walks, code inspections, testing, maintenance, code improvement, and teamwork.","Graded","Fall and/or Spring"
"ECE","353","Introduction to Operating Systems","Basic concepts and principles of multiprogrammed operating systems. Processes, interprocess communication, CPU scheduling, mutual exclusion, deadlocks, memory management, I/O devices, file systems, protection mechanisms. Also taught as Electrical and Computer Engineering 353. Prerequisites: Computer Science 201; and either of Computer Science 210D, Computer Science 250D or Electrical and Computer Engineering 250D.","Graded","Fall Only"
"ECE","356","Computer Network Architecture","Introduces students to the fundamentals of computer networks. Focus on layered architecture of the network protocol stack. Case studies drawn from the Internet, combined with practical programming exercises. Concepts include the Internet architecture, HTTP, DNS, P2P, Sockets, TCP/IP, BGP, routing protocols, and wireless/mobile networking and their applications such as how to achieve reliable/secure communications over channels, how to find a good path through a network, how to share network resources among competing entities, how to find an object in the network, and how to build network applications. Prerequisite: ECE 250D, CompSci 210D or CompSci 250D.","Graded","Fall and/or Spring"
"ECE","364","Performance and Technology: Composition Workshop","Workshop exploration of technologies embedded in performance: robots, media, computer interface. Students create performance projects and discuss theoretical and historical implications of technologies in performance. Open to dancers, actors, musicians, spoken word artists and all those interested in technology and the arts. No previous experience or programming skills required.","Graded","Fall and/or Spring"
"ECE","365","Rainforest Engineering","An open-format project-based class for student team design with a focus on rainforests and related environments. Engages students in cross-disciplinary team challenges that teach them to work together with other students of differing backgrounds and skills. Design challenges are similar to the XPRIZE contests, or the NAE Grand Challenges. Prerequisite: Electrical and Computer Engineering 230L or 250D or 270DL or 280L or Mechanical Engineering 221L or Engineering 244L or Environment 102.","Graded","Spring Only"
"ECE","366A","Drones in Marine Biology, Ecology, and Conservation","Lecture-based version of Environment 335LA. Includes a full overview of past and emerging applications for ecology and biology of marine species and coastal habitats, with in-depth discussion on future of drone applications in coastal biological and ecological research. Comprehensive exploration of current drone technologies, including detection of target species, payloads, aeronautical concepts, rules and regulations, mission planning, aircraft design, maintenance, data collection, management and analysis. Lab components tailored to student interests: active participation in megafaunal or environmental research and data analysis; building, operating and maintaining aircraft, programming for manual and autonomous flight. Taught in Beaufort at Duke Marine Lab.","Graded","Occasionally"
"ECE","370D","Intermediate Electromagnetic Theory","Fundamentals of electrostatic and magnetostatic fields, including fields in matter, and magnetostatic forces. Boundary value problems, Maxwell's Equations, and propagation of electromagnetic waves. Fundamentals and application of transmission lines, waveguides, and antennas. Prerequisite: Electrical and Computer Engineering 270DL.","Graded","Fall Only"
"ECE","380","Introduction to Random Signals and Noise","Introduction to probability and random processes with example applications to processing data with uncertainty. Probability, conditional probability, discrete & continuous random variables, expected values, characteristic functions, multiple random variables. Intro to random processes, random discrete-time signals, power spectrum, autocorrelation, analysis of linear systems driven by wide-sense stationary random processes. Gaussian random processes, band limited white Gaussian noise. Intro to binary hypothesis testing, Bayesian signal detection, applications involving uncertain & random signals & noise. Prerequisite: ECE 280L, Math 212 or 219.","Graded","Spring Only"
"ECE","381","Fundamentals of Digital Signal Processing","An introduction to theory and applications of digital signal processing. Concepts, analytical tools and design techniques to process signals in digital form. Signal sampling and reconstruction, discrete-time transforms including the z-transform, discrete-time Fourier transform, and discrete Fourier transform. Discrete systems including the analysis and design of FIR and IIR filters. Introduction to applications of digital signal processing such as image processing, and optimal detection of signals in noise. Discrete system simulations using MATLAB. Prerequisite: Electrical and Computer Engineering 280L.","Graded","Fall Only"
"ECE","382L","Control of Dynamic Systems","Model dynamic systems, characterize time and frequency domain response with respect to particular inputs. Characterize systems in terms of rise-time, settling-time, bandwidth. Identify the difference between stable and unstable system. Apply feedback control to modify response of dynamic systems. Develop methods of designing compensators for single-input, single-output, and multiple-input, multiple-output dynamic systems. Introduces optimal control theory, the linear quadratic regulator problem, the linear quadratic Gaussian problem. Gain a physical understanding of role of feedback control in modifying the dynamics of a system. Prerequisite: (Engineering 224L or ECE 280L) and Mathematics 216. Not open to students who have taken ECE 382.","Graded","Fall and/or Spring"
"ECE","383","Introduction to Robotics and Automation","Fundamental notions in robotics, basic configurations of manipulator arm design, coordinate transformations, control functions, and robot programming. Applications of artificial intelligence, machine vision, force/torque, touch and other sensory subsystems. Design for automatic assembly concepts, tools, and techniques. Application of automated and robotic assembly costs, benefits, and economic justification. Selected laboratory and programming assignments. Prerequisites: ECE 280L or EGR 224L.","Graded","Fall Only"
"ECE","384LA","Sound in the Sea: Introduction to Marine Bioacoustics","Fundamentals of marine bioacoustics with a focus on current literature and conservation issues. Topics include: introduction to acoustics; acoustic analysis methods and quantitative tools; production and recording of sound; ocean noise; propagation theory; active and passive acoustics; hearing, sound production and communication in marine organisms, potential impacts of anthropogenic noise; and regulation of marine sound. Labs will focus on methodologies used for generating, recording and analyzing marine sounds. Taught in Beaufort at Duke Marine Lab.","Graded","Fall and/or Spring"
"ECE","391","Projects in Electrical and Computer Engineering","Project arranged on a special topic by an instructor with related interests and expertise. For junior students. Consent of instructor and director of undergraduate studies required.","Graded","Fall Only"
"ECE","392","Projects in Electrical and Computer Engineering","Project arranged on a special topic by an instructor with related interests and expertise. For junior students. Consent of instructor and director of undergraduate studies required.","Graded","Spring Only"
"ECE","393A","ECE Research Independent Study","Independent study in Electrical & Computer Engineering. Taught in Beaufort at Duke Marine Lab.","Graded","Fall and/or Spring"
"ECE","420","Introduction to Quantum Engineering","Quantum mechanics was discovered at the beginning of the 20th century and has had a profound effect on the development of modern technology. This course is about the potential for quantum technologies in the 21st century. The focus of the course this semester will be a survey of quantum computation, a field that promises to revolutionize the way we compute by using the dynamics of quantum mechanics. Topics include quantum circuits, introduction to quantum algorithms, hardware, and architectures. Prerequisite: ECE 270DL and ECE 280L and one of (Math 216, 218D-1, 218D-2, or 221). Not open to students who have taken ECE 520.","Graded","Fall Only"
"ECE","431","Power Electronic Circuits for Energy Conversion","Efficient conversion of electrical energy is critical for electric and hybrid vehicles, wind and solar energy, power grids, computers, medical devices, and portables. This course teaches analysis and design of power electronic circuits for energy conversion, including circuit operation (converter topologies, steady-state modeling, switch realization), converter control (ac modeling, small-signal transfer functions, feedback), and magnetics (inductors, transformers). The course shares lectures with ECE/Energy Engineering 531, but has fewer assignments. Prerequisite: ECE 230L or Engineering 224L or graduate student standing. Not open to students who have taken ECE 531 or Energy Engineering 531.","Graded","Occasionally"
"ECE","449","Sensors and Sensor Interface Design","Teams design board-level sensing system that achieves stated specifications. Analog, digital, wireless, optical & fluidic components. Resource planning/management, project budgeting, study of component specs & characteristics, vendor interaction, circuit schematic design & simulation, board layout, submission to foundry, component solder assembly, system test, comparison to design specs. Cost, economic viability, ethical & environmental issues, manufacturability considered. Prerequisite: ECE 230L, 250D, 270DL, and 280L & MATH 353 & (MATH 230 or ECE 555 or ECE 380 or STA 240L or EGR 238L or MATH 238L or MATH 340) & PHYS 152L & CHEM 101DL & one of (ECE 330L or ECE 331L or ECE 340L or ECE 350L).","Graded","Spring Only"
"ECE","458","Engineering Software for Maintainability","Students will refine their ability to engineer software, with a focus on maintainability. Teams complete a large programming project whose requirements undergo evolutions during the semester. Prior to each evolution, teams submit their code for the current requirements and a written document analyzing their current design and reflecting on how past design choices impacted their most recent work. Teams must consider appropriate engineering standards and realistic constraints. Perquisite: ECE 230L, 250D, 270DL, and 280L and (CompSci 308 or 307D or Instructor Permission) and (Math 353 or 356) and (STA 130L or Math 230 or Math 231 or ECE 555 or ECE 380 or STA 240L or EGR 238L or Math340) and (Physics 152L or 26) and (Chem 101DL or 20 or 21).","Graded","Spring Only"
"ECE","459","Introduction to Embedded Systems","An introduction to hardware/software codesign of embedded computer systems. Structured programming techniques for high and low level programs. Hardware interfacing strategies for sensors, actuators, and displays. Detailed study of Motorola 68HC11 and 68HC12 microcomputers as applied to embedded system development. Hardware and simulation laboratory exercises with 68HC11 and 68HC12 development boards. Major design project. Prerequisite: ECE 230L and 250D and 270DL and 280L and (ECE 350L, 331L, or 330L) and (Mathematics 353 or 356) and (Physics 152L or 26) and (Chemistry 101DL, 20, or 21) and (Statistical Science 130, Mathematics 230, ECE 555, ECE 380, Statistical Science 240L, Engineering 238L, or Mathematics 340).","Graded","Fall Only"
"ECE","461","Ocean Engineering","A challenging Ocean Engineering project will be undertaken in this class. Past examples include participation in a national XPRIZE contest to build an Ocean Sensor. Students define project scope and form task-oriented sub-teams to make significant progress toward overall class project goal. Students are expected to spend several hours per week outside of class working on the team projects. Students will need to be in teams that can all meet for at least couple of hours at the same time each week. Prerequisite: one of ECE 230L, ECE 250D, ECE 270DL, ECE 280L, Mechanical Engineering 221L, Engineering 244L, or Environment 102.","Graded","Fall Only"
"ECE","461A","Ocean Engineering","A challenging Ocean Engineering project will be undertaken in this class. Past examples include participation in a national XPRIZE contest to build an Ocean Sensor. Students define project scope and form task-oriented sub-teams to make significant progress toward overall class project goal. Students are expected to spend several hours per week outside of class working on the team projects. Students will need to be in teams that can all meet for at least couple of hours at the same time each week. Prerequisite: one of ECE 230L, ECE 250D, ECE 270DL, ECE 280L, Mechanical Engineering 221L, Engineering 244L, or Environment 102. Taught in Beaufort at the Duke Marine Lab.","Graded","Spring Only"
"ECE","469","Wearable and Ubiquitous Computing Systems Design","Design, implement, and evaluate wearable and ubiquitous computing systems. Topics include challenges and constraints in wearable and ubiquitous computing, input/output devices, human-computer interaction, embedded systems, prototyping, machine learning with focus on activity and affect recognition, applications with focus on healthcare, ethics, and social impact; project management and planning as students work on a semester-long team-based multidisciplinary project. Prerequisite: ECE 350L, ECE 230L, 250D, 270DL, and 280L and (Math 353 or 356) and (Math 230 or ECE 555 or ECE 380 or StatSci 240L or EGR 238L or Math 340) and (Physics 152L or 26) and (Chem 101DL or 20 or 21).","Graded","Spring Only"
"ECE","480","Applied Probability for Statistical Learning","This course discusses topics in Bayesian probability and its application to foundations of statistical learning. The primary objectives of the course are to provide a mathematically rigorous foundation in Bayesian probability and inference, develop strong intuition for Bayesian constructs, provide a foundation in statistical learning, and to show how Bayesian methods are fundamental to a variety of modern statistical learning techniques. Topics include probabilistic reasoning, Bayesian inference, linear models, mixture models, and model selection. Prerequisite: (Mathematics 216, 218, or 221) and (Statistical Science 130L, Statistical Science 240L, Mathematics 230, Mathematics 340, ECE 380, ECE 555, or EGR 238L) and (EGR 103L, Computer Science 101L, or Computer Science 201).","Graded","Fall Only"
"ECE","483","Introduction to Digital Communication Systems","Introduction to the design and analysis of modern digital communication systems. Communication channel characterization. Baseband and passband modulation techniques. Optimal demodulation techniques with performance comparisons. Key information-theoretic concepts including entropy and channel capacity. Channel-coding techniques based on block, convolutional and Trellis codes. Equalization techniques. Applications to design of digital telephone modems, compact discs and digital wireless communication systems. Prerequisite: ECE 280L and one of (Statistical Science 130L or Statistical Science 240L or Mathematics 230 or or Mathematics 340 or ECE 380 or ECE 555 or Engineering 238L).","Graded","Fall Only"
"ECE","485","Digital Audio and Acoustic Signal Processing","Fundamental concepts, theory & practice of digital audio and acoustic signal processing. Concerning the process of transducing, digitizing, filtering, transforming, coding, storing, manipulating, transmitting, distributing, analyzing & reproducing high quality music and other acoustic signals. Topics: signal quantization, discrete-time signal analysis, audio digital filtering and equalization, hearing for audio applications, audio perceptual encoding (e.g. MP3), time and pitch-scale modification, room acoustics, audio spatial effects, 3-D audio rendition, basic microphone array processing. Prerequisite: ECE 280L and one of (Statistical Science 130L or Statistical Science 240L or Mathematics 230 or or Mathematics 340 or ECE 380 or ECE 555 or Engineering 238L).","Graded","Spring Only"
"ECE","487","System Design for Machine Learning and Signal Processing","Small groups work through design process for a machine learning &/or signal processing system. Brainstorming ideas, reviewing modern techniques in ML & SP, choosing & implementing projects. Use of modern collaboration tools & techniques that allow agile collaborative group design & development, consideration of resources, delivery of written & oral presentations, consideration of appropriate engineering standards & realistic constraints. Prerequisites: ECE 230L & 250D & 270DL & 280L & (MATH 353 or 356) & (STA 240L, MATH 230, 231, 238L or 340, ECE 555 or EGR 238L) & (PHYSICS 26 or 152L) & (CHEM 101DL, 20 or 21) & two Signal Processing, Communication & Controls concentration electives.","Graded","Spring Only"
"ECE","488","Digital Image and Multidimensional Processing","Introduction to the theory and methods of digital image and video sampling, denoising, coding, reconstruction, and analysis. Both linear methods (such as 2- and 3-D Fourier analysis) and non-linear methods (such as wavelet analysis). Key topics include segmentation, interpolation, registration, noise removal, edge enhancement, halftoning and inverse halftoning, deblurring, tomographic reconstruction, superresolution, compression, and feature extraction. While this course covers techniques used in a wide variety of contexts, it places a strong emphasis on medical imaging applications. Prerequisite: Electrical and Computer Engineering 280L.","Graded","Spring Only"
